{
  "id": "spotlight-pengantin-setan",
  "title": "PENGANTIN SETAN",
  "subtitle": "FILM HOROR AWAL TAHUN 2025",
  "year": 2025,
  "duration": "1j 31m",
  "genre": "Horor",
  "rating": 4,
  "posterUrl": "assets/images/poster_pengantin_setan.jpg",
  "backgroundSceneUrl": "assets/images/spotlight_scene.jpg",
  "synopsis": "Sebuah pasangan pengantin baru yang menempati rumah warisan leluhur mendapati bahwa ranjang pengantin mereka dijaga oleh sesosok arwah pengantin setan yang menuntut tumbal darah perawan.",
  "actionLabel": "PLAY NOW",
  "trailerUrl": "https://www.youtube-nocookie.com/embed/84qF8R1RjX4?autoplay=1"
}
